{
  "schema_version": "1.0",
  "request_id": "understanding-demo",
  "result_ref": {
    "result_id": "understanding-workflow",
    "revision": "1"
  },
  "spec_id": "understanding-mp4",
  "renderer_id": "mp4",
  "status": "generated",
  "artifact_refs": [
    {
      "ref": "presentation.mp4",
      "format": "mp4",
      "media_type": "video/mp4",
      "sha256": "bd9810cd4f6d2a106c97f0be28c5e62435b9abd22dfa22f703dd1c57cd87f60f"
    },
    {
      "ref": "guide.html",
      "format": "html",
      "media_type": "text/html",
      "sha256": "02792a756f5a7549dd7a2dc3f7735735a9dac45fabffa3d11e6736a23b29bd93"
    }
  ],
  "validation_results": [
    {
      "check_id": "contracts_and_bindings",
      "status": "passed",
      "message": "结构、引用、版本与同目录文件保存已检查"
    },
    {
      "check_id": "writing_rules",
      "status": "passed",
      "message": "26 sentences checked; profile ste-inspired; ASD compliance not claimed"
    },
    {
      "check_id": "semantic_review",
      "status": "not_checked",
      "message": "人工核对解释和教学示例是否忠于事实"
    },
    {
      "check_id": "visual_review",
      "status": "not_checked",
      "message": "打开真实产物检查可读性和导航"
    },
    {
      "check_id": "video_streams",
      "status": "passed",
      "message": "ffprobe verified video/subtitles and requested narration audio"
    }
  ],
  "warnings": [
    "静态检查不证明用户已经理解；人工语义与视觉检查需单独记录。"
  ],
  "feature_checks": [
    {
      "check_id": "R1",
      "status": "passed",
      "message": "理解目标已映射到内容与检查方法"
    },
    {
      "check_id": "R2",
      "status": "passed",
      "message": "解释/核验绑定同一版本并保留原始数据"
    },
    {
      "check_id": "R3",
      "status": "passed",
      "message": "用过期资料的假设反例说明，改变表达不能代替核验。"
    },
    {
      "check_id": "R4",
      "status": "passed",
      "message": "4 个可复制完整任务；未执行外部回调"
    },
    {
      "check_id": "R5",
      "status": "passed",
      "message": "first_version；基线已回读恢复"
    },
    {
      "check_id": "R6",
      "status": "passed",
      "message": "面向首次了解本 Skill 的读者，先看用途、形式选择和核验边界。"
    }
  ],
  "baseline_receipt": {
    "ref": "baseline.json",
    "result_ref": {
      "result_id": "understanding-workflow",
      "revision": "1"
    },
    "sha256": "1b635b172814e8b25bcfd957eabb91478679916821b210fc0e5af609ce8e78f7",
    "restored": true
  },
  "continuation_refs": [
    "continuations.json"
  ]
}
