{
  "schema_version": "1.0",
  "request_id": "understanding-demo",
  "result_ref": {
    "result_id": "understanding-workflow",
    "revision": "1"
  },
  "spec_id": "understanding-markdown",
  "renderer_id": "markdown",
  "status": "generated",
  "artifact_refs": [
    {
      "ref": "presentation.md",
      "format": "markdown",
      "media_type": "text/markdown",
      "sha256": "8969800e8073a188c02866ec19e0c93e042c735d590efadaf09241dce67b8331"
    }
  ],
  "validation_results": [
    {
      "check_id": "contracts_and_bindings",
      "status": "passed",
      "message": "结构、引用、版本与同目录文件保存已检查"
    },
    {
      "check_id": "writing_rules",
      "status": "passed",
      "message": "15 sentences checked; profile ste-inspired; ASD compliance not claimed"
    },
    {
      "check_id": "semantic_review",
      "status": "not_checked",
      "message": "人工核对解释和教学示例是否忠于事实"
    },
    {
      "check_id": "visual_review",
      "status": "not_checked",
      "message": "打开真实产物检查可读性和导航"
    }
  ],
  "warnings": [
    "静态检查不证明用户已经理解；人工语义与视觉检查需单独记录。"
  ],
  "feature_checks": [
    {
      "check_id": "R1",
      "status": "passed",
      "message": "理解目标已映射到内容与检查方法"
    },
    {
      "check_id": "R2",
      "status": "passed",
      "message": "解释/核验绑定同一版本并保留原始数据"
    },
    {
      "check_id": "R3",
      "status": "passed",
      "message": "用过期资料的假设反例说明，改变表达不能代替核验。"
    },
    {
      "check_id": "R4",
      "status": "passed",
      "message": "4 个可复制完整任务；未执行外部回调"
    },
    {
      "check_id": "R5",
      "status": "passed",
      "message": "first_version；基线已回读恢复"
    },
    {
      "check_id": "R6",
      "status": "passed",
      "message": "面向首次了解本 Skill 的读者，先看用途、形式选择和核验边界。"
    }
  ],
  "baseline_receipt": {
    "ref": "baseline.json",
    "result_ref": {
      "result_id": "understanding-workflow",
      "revision": "1"
    },
    "sha256": "3e916a786f8fc9757592b3180e5a89eb64e87bbcef0039b48afb25d48eaa88f3",
    "restored": true
  },
  "continuation_refs": [
    "continuations.json"
  ]
}
