{
  "schema_version": "1.0",
  "request_id": "understanding-demo",
  "result_ref": {
    "result_id": "understanding-workflow",
    "revision": "1"
  },
  "spec_id": "understanding-svg",
  "renderer_id": "svg",
  "status": "generated",
  "artifact_refs": [
    {
      "ref": "presentation.svg",
      "format": "svg",
      "media_type": "image/svg+xml",
      "sha256": "f6ae1d6653e123ffc571b86c6e77a2978474a91e290796baa9d10bfcaaaed0ad"
    },
    {
      "ref": "guide.html",
      "format": "html",
      "media_type": "text/html",
      "sha256": "c3cc97efa6ef1636a4d559875fa7860dbddf6fd1f8962f168d3601edfee84a67"
    }
  ],
  "validation_results": [
    {
      "check_id": "contracts_and_bindings",
      "status": "passed",
      "message": "结构、引用、版本与同目录文件保存已检查"
    },
    {
      "check_id": "writing_rules",
      "status": "passed",
      "message": "15 sentences checked; profile ste-inspired; ASD compliance not claimed"
    },
    {
      "check_id": "semantic_review",
      "status": "not_checked",
      "message": "人工核对解释和教学示例是否忠于事实"
    },
    {
      "check_id": "visual_review",
      "status": "not_checked",
      "message": "打开真实产物检查可读性和导航"
    }
  ],
  "warnings": [
    "静态检查不证明用户已经理解；人工语义与视觉检查需单独记录。"
  ],
  "feature_checks": [
    {
      "check_id": "R1",
      "status": "passed",
      "message": "理解目标已映射到内容与检查方法"
    },
    {
      "check_id": "R2",
      "status": "passed",
      "message": "解释/核验绑定同一版本并保留原始数据"
    },
    {
      "check_id": "R3",
      "status": "passed",
      "message": "用过期资料的假设反例说明，改变表达不能代替核验。"
    },
    {
      "check_id": "R4",
      "status": "passed",
      "message": "4 个可复制完整任务；未执行外部回调"
    },
    {
      "check_id": "R5",
      "status": "passed",
      "message": "first_version；基线已回读恢复"
    },
    {
      "check_id": "R6",
      "status": "passed",
      "message": "面向首次了解本 Skill 的读者，先看用途、形式选择和核验边界。"
    }
  ],
  "baseline_receipt": {
    "ref": "baseline.json",
    "result_ref": {
      "result_id": "understanding-workflow",
      "revision": "1"
    },
    "sha256": "0609262f012b36a65da7611c12c70da7558b7e80a02257148653588773510a8c",
    "restored": true
  },
  "continuation_refs": [
    "continuations.json"
  ]
}
